{"$defs":{"actor":{"additionalProperties":false,"properties":{"origin":{"enum":["direct","delegated","remote"]},"principal":{"maxLength":256,"minLength":1,"type":"string"}},"required":["principal","origin"],"type":"object"},"budget":{"additionalProperties":false,"properties":{"max_artifact_bytes":{"maximum":65536,"minimum":1,"type":"integer"},"max_output_bytes":{"maximum":65536,"minimum":1,"type":"integer"},"max_steps":{"maximum":4,"minimum":1,"type":"integer"},"max_wall_time_ms":{"maximum":300000,"minimum":1,"type":"integer"}},"required":["max_wall_time_ms","max_output_bytes","max_artifact_bytes","max_steps"],"type":"object"},"causality":{"additionalProperties":false,"properties":{"parent_operation_id":{"oneOf":[{"$ref":"#/$defs/runId"},{"type":"null"}]},"root_operation_id":{"oneOf":[{"$ref":"#/$defs/runId"},{"type":"null"}]}},"required":["parent_operation_id","root_operation_id"],"type":"object"},"digest":{"pattern":"^[0-9a-f]{64}$","type":"string"},"effects":{"additionalProperties":false,"properties":{"action_digest":{"$ref":"#/$defs/digest"},"network_allowed":{"type":"boolean"},"read_roots":{"items":{"maxLength":4096,"minLength":1,"type":"string"},"maxItems":32,"type":"array","uniqueItems":true},"write_roots":{"items":{"maxLength":4096,"minLength":1,"type":"string"},"maxItems":32,"type":"array","uniqueItems":true}},"required":["read_roots","write_roots","network_allowed","action_digest"],"type":"object"},"provenance":{"additionalProperties":false,"properties":{"digest":{"$ref":"#/$defs/digest"},"source":{"maxLength":4096,"minLength":1,"type":"string"}},"required":["source","digest"],"type":"object"},"replay":{"additionalProperties":false,"properties":{"class":{"enum":["deterministic","recorded_effect","non_replayable"]},"intent":{"enum":["execute_once","read_recorded"]}},"required":["class","intent"],"type":"object"},"runId":{"pattern":"^v1:recursive-agent/run/v1:det:[0-9a-f]{64}$","type":"string"},"runSpec":{"additionalProperties":false,"properties":{"frozen_clock":{"oneOf":[{"format":"date-time","type":"string"},{"type":"null"}]},"name":{"maxLength":256,"minLength":1,"type":"string"},"policy_version":{"maxLength":64,"minLength":1,"type":"string"},"steps":{"items":{"$ref":"#/$defs/step"},"maxItems":4,"minItems":1,"type":"array"}},"required":["name","steps","frozen_clock","policy_version"],"type":"object"},"step":{"additionalProperties":false,"properties":{"call":{"$ref":"#/$defs/toolCall"},"name":{"maxLength":256,"minLength":1,"type":"string"}},"required":["name","call"],"type":"object"},"toolCall":{"additionalProperties":false,"properties":{"args":{},"frozen_clock":{"oneOf":[{"format":"date-time","type":"string"},{"type":"null"}]},"tool":{"enum":["echo","time.now","shell"]}},"required":["tool","args","frozen_clock"],"type":"object"}},"$id":"urn:recursive-agent:schema:operation:v1","$schema":"https://json-schema.org/draft/2020-12/schema","additionalProperties":false,"properties":{"actor":{"$ref":"#/$defs/actor"},"budget":{"$ref":"#/$defs/budget"},"causality":{"$ref":"#/$defs/causality"},"effects":{"$ref":"#/$defs/effects"},"provenance":{"items":{"$ref":"#/$defs/provenance"},"maxItems":32,"minItems":1,"type":"array"},"replay":{"$ref":"#/$defs/replay"},"run_spec":{"$ref":"#/$defs/runSpec"},"schema":{"const":"recursive-agent.operation/v1"}},"required":["schema","actor","causality","budget","effects","provenance","replay","run_spec"],"title":"Recursive Agent OperationEnvelopeV1","type":"object"}