{"actor":{"origin":"direct","principal":"actor:test"},"budget":{"max_artifact_bytes":4096,"max_output_bytes":4096,"max_steps":1,"max_wall_time_ms":1000},"causality":{"parent_operation_id":null,"root_operation_id":null},"effects":{"action_digest":"9ea93ede3bb046a4242d8f05eaa32bdbbd7a9e3724eb2e7d298ea99ee6f26e16","network_allowed":false,"read_roots":[],"write_roots":[]},"provenance":[{"digest":"74d2052c62913e1ff9bcec2145c76325a42a6ddf4112ebe84e2103fa15a09456","source":"urn:test:request"}],"replay":{"class":"deterministic","intent":"execute_once"},"run_spec":{"frozen_clock":null,"name":"phase2-envelope","policy_version":"policy-v1","steps":[{"call":{"args":{"text":"hello"},"frozen_clock":null,"tool":"echo"},"name":"echo"}]},"schema":"recursive-agent.operation/v1"}